[
  {
    "control_id": "CTRL-001",
    "canonical_field": "management.ssh.version",
    "description": "SSH must be restricted to version 2",
    "operator": "eq",
    "expected_value": 2,
    "severity": "high",
    "nist_800_53": [
      "SC-8",
      "SC-13",
      "SC-23"
    ],
    "cis": [
      {
        "vendor": "cisco_ios_xe",
        "benchmark": "CIS Cisco IOS XE 17.x Benchmark v2.2.1",
        "rec_id": "2.1.1.2"
      },
      {
        "vendor": "juniper_junos",
        "benchmark": "CIS Juniper OS Benchmark v2.1.0",
        "rec_id": "6.10.1.2"
      },
      {
        "vendor": "fortinet_fortios",
        "benchmark": "CIS FortiGate 7.4.x Benchmark v1.0.1",
        "rec_id": null,
        "note": "No SSH version control in this benchmark"
      },
      {
        "vendor": "paloalto_panos",
        "benchmark": "CIS Palo Alto Firewall 11 Benchmark v1.2.0",
        "rec_id": null,
        "note": "No SSH version control in this benchmark"
      },
      {
        "vendor": "arista_eos",
        "benchmark": "CIS Arista EOS Benchmark v1.0.0",
        "rec_id": null,
        "note": "No SSH version control in this benchmark"
      }
    ],
    "stig": [
      {
        "vendor": "cisco_ios_xe",
        "stig_id": "CISC-ND-001210 (+001200)"
      },
      {
        "vendor": "juniper_junos",
        "stig_id": "JUNI-ND-001200"
      },
      {
        "vendor": "fortinet_fortios",
        "stig_id": "FGFW-ND-000205",
        "note": "STIG ID from public DISA FortiGate Firewall NDM STIG (V1R4/V1R5); not in provided zip \u2014 verify against official XCCDF before use"
      },
      {
        "vendor": "paloalto_panos",
        "stig_id": null,
        "note": "No STIG rule covers this control"
      },
      {
        "vendor": "arista_eos",
        "stig_id": "ARST-ND-000700",
        "note": "Closest fit \u2014 no dedicated STIG rule for this control"
      }
    ],
    "iso_27001": [
      "8.20",
      "8.24"
    ]
  },
  {
    "control_id": "CTRL-002",
    "canonical_field": "management.telnet.enabled",
    "description": "Telnet must be disabled for device management",
    "operator": "eq",
    "expected_value": false,
    "severity": "high",
    "nist_800_53": [
      "CM-7",
      "SC-7",
      "SC-8",
      "SC-23"
    ],
    "cis": [
      {
        "vendor": "cisco_ios_xe",
        "benchmark": "CIS Cisco IOS XE 17.x Benchmark v2.2.1",
        "rec_id": "1.2.2"
      },
      {
        "vendor": "juniper_junos",
        "benchmark": "CIS Juniper OS Benchmark v2.1.0",
        "rec_id": "6.10.6"
      },
      {
        "vendor": "fortinet_fortios",
        "benchmark": "CIS FortiGate 7.4.x Benchmark v1.0.1",
        "rec_id": "2.4.5"
      },
      {
        "vendor": "paloalto_panos",
        "benchmark": "CIS Palo Alto Firewall 11 Benchmark v1.2.0",
        "rec_id": "1.2.3"
      },
      {
        "vendor": "arista_eos",
        "benchmark": "CIS Arista EOS Benchmark v1.0.0",
        "rec_id": "2.8"
      }
    ],
    "stig": [
      {
        "vendor": "cisco_ios_xe",
        "stig_id": "CISC-ND-000140",
        "note": "Closest fit \u2014 no dedicated STIG rule for this control"
      },
      {
        "vendor": "juniper_junos",
        "stig_id": "JUNI-ND-000470"
      },
      {
        "vendor": "fortinet_fortios",
        "stig_id": "FGFW-ND-000265",
        "note": "STIG ID from public DISA FortiGate Firewall NDM STIG (V1R4/V1R5); not in provided zip \u2014 verify against official XCCDF before use"
      },
      {
        "vendor": "paloalto_panos",
        "stig_id": "PANW-NM-000061"
      },
      {
        "vendor": "arista_eos",
        "stig_id": "ARST-ND-000340"
      }
    ],
    "iso_27001": [
      "8.20",
      "8.24"
    ]
  },
  {
    "control_id": "CTRL-003",
    "canonical_field": "management.http.enabled",
    "description": "HTTP (unencrypted) management interface must be disabled",
    "operator": "eq",
    "expected_value": false,
    "severity": "high",
    "nist_800_53": [
      "CM-7",
      "SC-7",
      "SC-8",
      "SC-23"
    ],
    "cis": [
      {
        "vendor": "cisco_ios_xe",
        "benchmark": "CIS Cisco IOS XE 17.x Benchmark v2.2.1",
        "rec_id": "1.2.9",
        "note": "Bundled with HTTPS control; benchmark has no standalone HTTP-disable rec"
      },
      {
        "vendor": "juniper_junos",
        "benchmark": "CIS Juniper OS Benchmark v2.1.0",
        "rec_id": "6.10.2.1"
      },
      {
        "vendor": "fortinet_fortios",
        "benchmark": "CIS FortiGate 7.4.x Benchmark v1.0.1",
        "rec_id": "2.4.5"
      },
      {
        "vendor": "paloalto_panos",
        "benchmark": "CIS Palo Alto Firewall 11 Benchmark v1.2.0",
        "rec_id": "1.2.3"
      },
      {
        "vendor": "arista_eos",
        "benchmark": "CIS Arista EOS Benchmark v1.0.0",
        "rec_id": "2.9",
        "note": "TOC has duplicate '2.9' numbering; this is the 'API access using https' entry"
      }
    ],
    "stig": [
      {
        "vendor": "cisco_ios_xe",
        "stig_id": "CISC-ND-000470"
      },
      {
        "vendor": "juniper_junos",
        "stig_id": null,
        "note": "No STIG rule covers this control; No router-STIG rule; SRX has JUSX-DM-000167"
      },
      {
        "vendor": "fortinet_fortios",
        "stig_id": "FGFW-ND-000265",
        "note": "STIG ID from public DISA FortiGate Firewall NDM STIG (V1R4/V1R5); not in provided zip \u2014 verify against official XCCDF before use"
      },
      {
        "vendor": "paloalto_panos",
        "stig_id": "PANW-NM-000061"
      },
      {
        "vendor": "arista_eos",
        "stig_id": "ARST-ND-000340"
      }
    ],
    "iso_27001": [
      "8.20",
      "8.24"
    ]
  },
  {
    "control_id": "CTRL-004",
    "canonical_field": "management.https.enabled",
    "description": "HTTPS must be enabled for web-based device management",
    "operator": "eq",
    "expected_value": true,
    "severity": "high",
    "nist_800_53": [
      "SC-8",
      "SC-13",
      "SC-23"
    ],
    "cis": [
      {
        "vendor": "cisco_ios_xe",
        "benchmark": "CIS Cisco IOS XE 17.x Benchmark v2.2.1",
        "rec_id": "1.2.9",
        "note": "Bundled with HTTP-disable control"
      },
      {
        "vendor": "juniper_junos",
        "benchmark": "CIS Juniper OS Benchmark v2.1.0",
        "rec_id": "6.10.2.2"
      },
      {
        "vendor": "fortinet_fortios",
        "benchmark": "CIS FortiGate 7.4.x Benchmark v1.0.1",
        "rec_id": "2.4.5"
      },
      {
        "vendor": "paloalto_panos",
        "benchmark": "CIS Palo Alto Firewall 11 Benchmark v1.2.0",
        "rec_id": "1.2.5"
      },
      {
        "vendor": "arista_eos",
        "benchmark": "CIS Arista EOS Benchmark v1.0.0",
        "rec_id": "2.9",
        "note": "TOC has duplicate '2.9' numbering; this is the 'API access using https' entry"
      }
    ],
    "stig": [
      {
        "vendor": "cisco_ios_xe",
        "stig_id": "CISC-ND-001210",
        "note": "Closest fit \u2014 no dedicated STIG rule for this control"
      },
      {
        "vendor": "juniper_junos",
        "stig_id": null,
        "note": "No STIG rule covers this control"
      },
      {
        "vendor": "fortinet_fortios",
        "stig_id": "FGFW-ND-000265",
        "note": "STIG ID from public DISA FortiGate Firewall NDM STIG (V1R4/V1R5); not in provided zip \u2014 verify against official XCCDF before use"
      },
      {
        "vendor": "paloalto_panos",
        "stig_id": null,
        "note": "No STIG rule covers this control"
      },
      {
        "vendor": "arista_eos",
        "stig_id": null,
        "note": "No STIG rule covers this control; ARST-ND-000340 makes HTTPS mgmt (http-commands) a STIG finding; no positive rule requiring HTTPS enabled"
      }
    ],
    "iso_27001": [
      "8.20",
      "8.24"
    ]
  },
  {
    "control_id": "CTRL-005",
    "canonical_field": "management.session.idle_timeout_minutes",
    "description": "Administrative sessions must time out after a maximum of 10 minutes of inactivity",
    "operator": "lte",
    "expected_value": 10,
    "severity": "medium",
    "nist_800_53": [
      "AC-11",
      "AC-12"
    ],
    "cis": [
      {
        "vendor": "cisco_ios_xe",
        "benchmark": "CIS Cisco IOS XE 17.x Benchmark v2.2.1",
        "rec_id": "1.2.6, 1.2.7, 1.2.8, 1.2.10",
        "note": "Separate exec-timeout recs for aux, console, vty, and http"
      },
      {
        "vendor": "juniper_junos",
        "benchmark": "CIS Juniper OS Benchmark v2.1.0",
        "rec_id": "6.6.3, 6.10.2.4",
        "note": "Login class idle timeout + web-mgmt idle timeout"
      },
      {
        "vendor": "fortinet_fortios",
        "benchmark": "CIS FortiGate 7.4.x Benchmark v1.0.1",
        "rec_id": "2.4.4"
      },
      {
        "vendor": "paloalto_panos",
        "benchmark": "CIS Palo Alto Firewall 11 Benchmark v1.2.0",
        "rec_id": "1.4.1"
      },
      {
        "vendor": "arista_eos",
        "benchmark": "CIS Arista EOS Benchmark v1.0.0",
        "rec_id": "2.4.1, 2.6.2",
        "note": "Console idle timeout + SSH idle timeout"
      }
    ],
    "stig": [
      {
        "vendor": "cisco_ios_xe",
        "stig_id": "CISC-ND-000720",
        "note": "STIG idle timeout threshold is 5 min, stricter than schema's <=10"
      },
      {
        "vendor": "juniper_junos",
        "stig_id": "JUNI-ND-000710",
        "note": "STIG idle timeout threshold is 5 min, stricter than schema's <=10"
      },
      {
        "vendor": "fortinet_fortios",
        "stig_id": "FGFW-ND-000275",
        "note": "STIG idle timeout threshold is 10 min; STIG ID from public DISA FortiGate Firewall NDM STIG (V1R4/V1R5); not in provided zip \u2014 verify against official XCCDF before use"
      },
      {
        "vendor": "paloalto_panos",
        "stig_id": "PANW-NM-000069",
        "note": "STIG idle timeout threshold is 10 min"
      },
      {
        "vendor": "arista_eos",